编码,名称
31.33511728E,上海华龙测试仪器有限公司
31.33732133Q,上海航天动力科技工程有限公司
31.34041211U,上海申光洗涤机械集团有限公司
31.34057356C,上海企源科技股份有限公司
31.34083220B,科建高分子材料（上海）股份有限公司
31.34416538L,上海气动成套公司三分厂
31.34512917,上海华讯网络系统有限公司
31.34557684,摩莎科技（上海）有限公司
31.34625090Y,上海稳达电讯设备厂
31.36438743N,哲弗智能系统（上海）有限公司
31.36673793C,挪亚检测技术有限公司
31.37455764,上海中陆国际贸易有限公司
31.38137601,上海瑞伯德智能系统股份有限公司
31.3853739XX,南德认证检测（中国）有限公司上海分公司
31.40265725E,上海宏蕾化工有限公司
31.42129495,上海成诚实业发展有限公司
31.42262051R,上海萱福实业有限公司
31.42292736X,上海携程宏睿国际旅行社有限公司
31.42308881E,上海和绚室内装饰有限公司
31.42500444,上海市城市建设设计研究总院
31.42500613,同济大学
31.4250143,中国船舶重工集团公司第七0四研究所
31.43753354,上海南邦洗涤剂有限公司
31.43757936A,上海东方明珠移动电视有限公司
31.45609662B,上海康比利仪表有限公司
31.46523350C,上海巨进机车配件有限公司
31.47267715A,英斯特朗（上海）试验设备贸易有限公司
31.47268152U,上海山雄自控设备有限公司
31.48148823,上海飞爵国际货物运输代理有限公司
31.4928384XX,上海癸荣机电科技有限公司
31.50593301,上海凯延计算机科技发展有限公司
31.50980336,谱弦测试技术（上海）有限公司
31.51007715,赛太（上海）液压科技有限公司
31.51103220B,懿朵信息科技（上海）有限公司
31.51113226J,上海蔚里精密机械科技有限公司
31.51141155H,上海凌光投资管理有限公司
31.51261147K,上海文景信息科技有限公司
31.51510322D,上海南济轨道设备科技开发有限公司
31.51575433E,上海亚竹化工科技有限公司
31.5290848XR,上海杨高电器有限公司
31.52931057L,上海博道电子商务有限公司
31.52943971Q,上海逊艺展览设计工程有限公司
31.52945467N,上海快联门业有限公司
31.53024321N,上海政采项目管理有限公司
31.53028760B,上海丸浜电子科技有限公司
31.53179551N,上海风语筑文化科技股份有限公司
31.54250933,上海宝曼企业管理咨询有限公司
31.55001658,上海锦东纸业有限公司
31.55056140C,上海波客实业有限公司
31.55151556,开勒环境科技（上海）股份有限公司
31.55431804,吕策贸易（上海）有限公司
31.55720487Y,上海日成电子有限公司
31.55882678,上海弘焱电子科技有限公司
31.56016111X,欧鹏投资咨询（上海）有限公司
31.56016318,上海福豆机械成套设备有限公司
31.56186356X,上海聚安实业有限公司
31.56189618,捷斯曼控制技术（上海）有限公司
31.56190708,上海上力特种电缆有限公司
31.56655874,华荣科技股份有限公司
31.56807181,艾立韦尔自动化工程技术（上海）有限公司
31.56955786,上海宝锻机械制造有限公司
31.57079212,上海远基企业管理咨询有限公司
31.57083407,上海厚泰贸易有限公司
31.57414994,多玛凯拔门控系统有限公司
31.57466992,上海瑞比度信息科技有限公司
31.57486693N,树格贸易（上海）有限公司
31.57570524,上海国力电气科技有限公司
31.57580061,泰尔精蜡（上海）有限公司
31.5769500XK,上海晨光科力普办公用品有限公司
31.57740695,威登（上海）机械设备有限公司
31.57742308,上海异晟实业有限公司
31.57742564,上海文采实业有限公司
31.57912029,正泰电气股份有限公司
31.57912611,伏能士（上海）商贸有限公司
31.57914995,上海卓仕工业品有限公司
31.57928601N,上海泉秀国际贸易有限公司
31.58205091,上海德勤税务师事务所有限公司
31.58340048,上海朗煜电子科技有限公司
31.58409491,上海海桐机械设备有限公司
31.58439887,上海炫界文化传播有限公司
31.58445361Y,法如科技（上海）有限公司
31.58529909,上海电气泰雷兹交通自动化系统有限公司
31.58757926J,上海易启检测技术有限公司
31.58867464,上海友森信息科技发展有限公司
31.5886768,上海逸发粘接化工科技有限公司
31.59004453T,上海缘陀电子科技发展有限公司
31.59006977Q,上海国缆检测股份有限公司
31.59038653Y,爱佩仪自动精密仪器科技（上海）有限公司
31.59040622N,耐博检测技术（上海）有限公司
31.59040651X,上海富欣智能交通控制有限公司
31.59169912,上海紫琛智能科技股份有限公司
31.59306944H,上海森克电子科技有限公司
31.59314735,西奔机电设备制造（上海）有限公司
31.59317218,上海杰之能软件科技有限公司
31.5959262XC,芳源企业（上海）有限公司
31.59810093,斯凯孚分拨（上海）有限公司
31.59815367,上海紫陌电子科技有限公司
31.60711641,欧时电子元件(上海)有限公司
31.6072034,摩根新材料（上海）有限公司
31.60720784,卡斯柯信号有限公司
31.6072174,上海汉欣电线电缆有限公司
31.60722075,上海普华科技发展有限公司
31.60722513,上海联合滚动轴承有限公司
31.60723114,爱迪西显示测控系统有限公司
31.60724953,诺冠气动器材(上海)有限公司
31.60726362,上海法维莱交通车辆设备有限公司
31.6072641,上海德意达电子电器设备有限公司
31.60726892,上海南洋电材有限公司
31.60727969,费斯托（中国）有限公司
31.60728201,上海康普艾压缩机有限公司
31.60728937,上海嘉里粮油工业有限公司
31.60731859,莱茵技术（上海）有限公司
31.60732114,上海威士文通风工程设备有限公司
31.6073479,优必胜（上海）轴承有限公司
31.60735774,美卡诺元器件(上海)有限公司
31.60735845,杜邦贸易(上海)有限公司
31.6073596,贺德克液压技术(上海)有限公司
31.60736158,依必安派特风机（上海）有限公司
31.60736461X,派克汉尼汾流体传动产品(上海)有限公司
31.60736951,威图电子机械技术(上海)有限公司
31.60737618,上海龙飞国际物流公司
31.60738339,烙克赛克国际贸易(上海)有限公司
31.60738377,西门子国际贸易（上海）有限公司
31.60738705,韬睿惠悦咨询（上海）有限公司
31.60738711,埃森哲（中国）有限公司
31.60739462,瑞侃（上海）贸易有限公司
31.6073948,新钶电子(上海)有限公司
31.6073961,恩艾（中国）仪器有限公司
31.60739892,福禄超高压水射流技术（上海）有限公司
31.60740719X,易格斯拖链轴承仓储贸易（上海）有限公司
31.60740745,上海申克机械有限公司
31.60740834,通号通信信息集团有限公司
31.60740970X,灏讯贸易（上海）有限公司
31.60741679,优成优氏建筑材料(上海)有限公司
31.60742078,上海魏德曼电力绝缘材料有限公司
31.60742981,亚萨合莱自动门系统（上海）有限公司
31.60743269,荷贝克电源系统（上海）有限公司
31.60744013,上海陇嘉自动化机械设备有限公司
31.60769017,上海新一名实业（集团）有限公司
31.60773439R,上海汉测智能科技有限公司
31.60856898W,毅联实业（上海）有限公司
31.6087720XY,上海亚坦仪器仪表有限公司
31.6088497X4,上海唯智工程项目管理有限公司
31.60895337W,上海数造机电科技股份有限公司
31.60904271Y,上海甘必地电子科技有限公司
31.61172326,上海怡翔国际货运发展有限公司
31.61180093C,上海精玛睿企业管理有限公司
31.61600895G,上海安越企业管理咨询有限公司
31.61639686,上海汉普液压机械有限公司
31.61876942T,弈镁（上海）贸易有限公司
31.61898041N,上海昊航商务咨询有限公司
31.62214961,上海斐然机械设备有限公司
31.62437106,上海禾舜机电设备有限公司
31.6244079X4,上海人从众企业管理咨询有限公司
31.62442749,美特斯工业系统（中国）有限公司
31.62448779G,上海安邦实业发展有限公司
31.62530875H,上海同屹会展服务有限公司
31.62562973K,上海昱炫船舶科技发展有限责任公司
31.63027925,上海爱康新型建材有限公司
31.63031092,上海怡润行交通设备有限公司
31.63034471,上海国之鼎铁路机电有限公司
31.63042907,上海远洋国际集装箱储运有限公司
31.6304491,上海扬升实业有限公司
31.63045248,上海凯泉泵业（集团）有限公司
31.63059604R,必维质量技术服务（上海）有限公司
31.63070397,上海文依电器有限公司
31.63072384,上海川岭仪器仪表合作公司
31.63078362T,上海图诺机电科技有限公司
31.63078595,上海南大集团有限公司
31.63079296,上海精星仓储设备工程有限公司
31.63079313X,上海鼎虎工业设备有限公司
31.63088621,上海奥威科技开发有限公司
31.6309039,上海天正机电（集团）有限公司
31.63103545,上海韦戈技术工程有限公司
31.63104825,上海豪讯贸易发展有限公司
31.63115507,上海巍诚科技发展有限公司
31.63116582,上海晨辉商务咨询有限公司
31.6311805,上海雯斌机电有限公司
31.63126962,上海盛立机电设备科技有限公司
31.63128389,上海德力西集团有限公司
31.63135891,全华物流中心有限公司
31.63143554,上海久立汽车配件制造有限公司
31.63143772,上海微积丰贸易发展有限公司
31.63144144,上海东车机车车辆销售租赁有限公司
31.63145898,上海博杰科技股份有限公司
31.63153395,上海至尊五金机电有限公司
31.63157986,上海电器设备检测所
31.63160451,上海佳茂电子有限公司
31.63161356,上海瑞克科技发展有限公司
31.63177442,上海加力搬运设备有限公司
31.63205394,上海申意地铁设备工程有限公司
31.63214333,上海明镒实业有限公司
31.63220638,上海震坤行贸易有限公司
31.63221076X,上海得力润滑油有限公司
31.63709199Q,得捷电子（上海）有限公司
31.64296091,上海启发物流有限公司
31.64349520B,上海澳马车辆物资采购有限公司
31.64779339,欧佩意（上海）液压管路加工设备有限公司
31.65576044J,埃特博朗咨询（上海）有限公司
31.6596037XW,上海舜华新能源系统有限公司
31.6596404,上海艺凯设计有限公司
31.66046627,上海福轩环保科技有限公司
31.6604855X3,上海特马液压设备有限公司
31.6607049,上海丰渡环保科技有限公司
31.6624954,上海太创计算机科技有限公司
31.66525308Y,上海能博会展有限公司
31.66556534,纵济本（上海）贸易有限公司
31.66600625,阿美特克商贸(上海)有限公司
31.6660881,上海韵友国际贸易有限公司
31.66778526,钛柯电子科技（上海）有限公司
31.66781081,上海纵横轨道交通设备有限公司
31.66935815,上海德托机械有限公司
31.66940811,安永（中国）企业咨询有限公司
31.67113909,上海协尔化学科技有限公司
31.67119372,上海路嘉电气有限公司
31.67266896X,上海海立特凯迈特制冷设备有限公司
31.67269088,上海日见电器设备有限公司
31.67269331,上海宇安贸易有限公司
31.67474915,上海源联木业有限公司宁波分公司
31.67625038,上海北塔软件股份有限公司
31.67625916X,雷莫电子（上海）有限公司
31.67626345X,上海隼特工业自动化工程有限公司
31.67628218,上海树俊纸业有限公司
31.67780121,上海尚娜无损检测设备有限公司
31.67782113,上海现尚电子科技有限公司
31.67783482,欧泰信息科技（上海）有限公司
31.67785286,上海瑞上兴通讯信号器材有限公司
31.67789214E,上海丽途旅游服务管理有限公司
31.67848529,上海浩泽诺瑞空气净化科技有限公司
31.67933187,上海惠骋实业发展有限公司
31.68009817,上海耀徽电气有限公司
31.68050908K,华伍轨道交通装备（上海）有限责任公司
31.68096226,北京市嘉源律师事务所上海分所
31.68227571,上海匡立汽车零部件有限公司
31.6838331XC,上海质行国际旅行社有限公司
31.68401254,上海林频仪器股份有限公司
31.68402958,上海汉尔得自动化设备有限公司
31.68403438,西阁玛软件系统（上海）有限公司
31.68408175,上海蓉达国际货运代理有限公司
31.68408647,上海粤欣铁路机械配件有限公司
31.68553937,中金招标有限责任公司上海分公司
31.68554489,上海鑫抚源国际贸易有限公司
31.68735957X,上海虎泰机电设备有限公司
31.68776172,上海剑平动平衡机制造有限公司
31.69014033,上海孚倍机电工程技术有限公司
31.69156853,上海中科深江电动车辆有限公司
31.69292349,上海坤友电气有限公司
31.69372463F,上海妙文会展服务有限公司
31.6937259,上海鼎襄机电设备有限公司
31.69382733C,罗巴鲁(上海)商贸有限公司
31.69406819P,上海步频电子科技有限公司
31.6940736,上海庆生测试设备有限公司
31.69421122,上海迪扬过滤系统有限公司
31.69421597X,上海松芝轨道车辆空调有限公司
31.69433094R,上海欣旋企业管理咨询有限公司
31.69628046N,上海硕恒实业有限公司
31.69636652R,励通（上海）机电设备有限公司
31.69877197,上海铁路物资有限公司
31.69881073,上海铂众汽车销售服务有限公司
31.70300862,灏讯通讯传送产品制造（上海）有限公司
31.70303103,上海邦德机电高科技有限公司
31.70309977,上海壬丰复合材料有限公司
31.70312193,上海亿科精细化学品有限责任公司
31.70313567,上海永达汽车浦西销售服务有限公司
31.70314475,上海一登办公家具有限公司
31.70314517,唯智信息技术（上海）股份有限公司
31.7031614,上海逊湖机电科技有限公司
31.70331021,发思特软件（上海）有限公司
31.70334987,上海通贸搬运机械有限公司
31.70344466,上海春光电子有限公司
31.70348101,上海海希工业通讯股份有限公司
31.70348632,上海锐得电子有限公司
31.70348916,欧地希机电(上海)有限公司
31.70774091W,上海通周机械设备工程有限公司
31.70914271M,上海金翅鹏实业有限公司
31.70918491,上海亦勒广告有限公司
31.71146204,上海禾骏焊接技术有限公司
31.71245013E,上海麒济检测科技有限公司
31.71412971,盐城市海通铁路配件有限公司
31.71785419,斯凯孚(中国)销售有限公司
31.71786109,捷爱士国际货物运输代理(上海)有限公司
31.72121566L,上海思百吉仪器系统有限公司
31.7212816XP,飞速主轴技术（上海）有限公司
31.72137963X,上海幻维数码创意科技有限公司
31.72403192B,法中轨道交通运输设备（上海）有限公司
31.72441228,上海传奇国际货物运输代理有限公司
31.72667094F,上海久翊汽车零部件有限公司
31.72677110B,思源清能电气电子有限公司
31.72699360F,上海伟佳展览服务有限公司
31.72744037E,上海加澳商贸有限公司
31.72872263A,索斯沃斯（上海）升降设备有限公司
31.72904105R,上海鼎厉实业有限公司
31.72940935,上海互联机电产品销售有限公司
31.72941923,上海华魏自动化设备有限公司
31.7294475,天钢金属（上海）有限公司
31.72946913,泰雷兹自动控制系统（上海）有限公司
31.72948407,上海中电罗莱电气股份有限公司
31.73282177G,万得信息技术股份有限公司
31.73336837,上海阳光物流有限公司
31.73338479,科尼起重机设备（上海）有限公司
31.73454091,海拉贸易（上海）有限公司
31.73457116,克鲁勃润滑剂(上海)有限公司
31.73541332,上海伟历信工程咨询有限公司
31.73543521,埃克塞德电源（上海）有限公司
31.73620933,索斯科锁定系统(上海)有限公司
31.7362324,上海胜华电缆（集团）有限公司
31.73665902,上海彦豪工贸有限公司
31.73666382,上海凯倍达电子科技有限公司
31.73666529,菱大机电设备(上海)有限公司
31.73745283,中海集团物流有限公司
31.73813491,上海铁润金属材料有限公司
31.7381376,上海瑞伯德智能系统科技有限公司
31.73853739X,南德认证检测(中国)有限公司上海分公司_
31.73854751,上海加冷松芝汽车空调股份有限公司
31.73900447,上海厦仪润滑产品有限公司
31.73977721,上海翘运货运代理有限公司
31.74119181X,劳士领国际贸易（上海）有限公司
31.74160377,上海三环弹簧有限公司
31.7426538,上海威盛国际贸易有限公司
31.74375335,上海南邦润滑剂（南邦洗涤剂）有限公司
31.74421447,上海海鹤机械配件制造有限公司
31.74422074,伍尔特（上海）五金工具有限公司
31.74424354X,上海奔宇泵业制造有限公司
31.7449051,上海科泰运输制冷设备有限公司
31.74494182,佰安表面处理（上海）有限公司
31.74562436,虎伯拉铰接系统(上海)有限公司
31.74650172,缆普电缆（上海）有限公司
31.74651947,上海群力紧固件制造有限公司
31.74653357,上海苏特电气有限公司
31.74728502,上海轨道交通设备发展有限公司
31.74762562,上海明索重型机械股份有限公司
31.74763547,上海英培商务咨询有限公司
31.74786739Y,上海舜毓机电设备有限公司
31.74806369,上海南浦仪表厂
31.74808511,莫尔塑料（上海）有限公司
31.74809227,上海特安一凯轴承有限公司
31.74809893,上海蓝科电气有限公司
31.74834104N,上海慧程工程技术服务有限公司
31.74879134,上海吉泰新电气有限公司
31.74925827,上海和山进出口有限公司
31.74926023,上海康茂胜自动控制有限公司
31.74927998X,尼康仪器（上海）有限公司
31.7503099,上海南星行汽车有限公司
31.75186127,欧科佳（上海）汽车电子设备有限公司
31.75247655,上海方逸自动化仪表有限公司
31.75294799,华荣集团有限公司
31.75382161,上海火石信息科技有限公司
31.75383961X,上海特纳机电科技有限公司
31.75384449,丹纳列车连接系统(上海)有限公司
31.75430242,上海天海受电弓制造有限公司
31.75478677,上海佰利信达电子有限公司
31.75479653,上海百纳德电子信息有限公司
31.75757622,上海强江电器设备有限公司
31.75771927H,上海英路电子有限公司
31.7579209,上海昌埭绝缘材料有限公司
31.75836212Q,慠克（上海）贸易有限公司
31.75856982,林柯赛尔（苏州）线缆科技有限公司
31.75903492,上海先秦机电设备有限公司
31.75987406,上海金仕达卫宁软件股份有限公司
31.75987498,可乐丽国际贸易（上海）有限公司
31.76059917,事百世（上海）建筑工程有限公司
31.76089128,上海聚星仪器有限公司
31.76160692,上海舒茨布伦德机电设备有限公司
31.76220257,上海地铁职业技能培训学校学杂费存取专户
31.76262092,上海前山管道技术有限公司
31.76292242,上海讯隆电子有限公司
31.76295689M,明幸科技发展（上海）有限公司
31.76301755,上海铁友电气有限公司
31.76304782,上海尼德轴承有限公司
31.76316832,上海俊豪机电设备有限公司
31.76427789,永恒力叉车（上海）有限公司
31.76429485,上海三汰包装材料有限公司
31.76451641X,上海君印智能设备制造有限公司
31.76531075,上海嘉投贸易有限公司
31.76531821,上海城轨车辆技术有限公司
31.76533313,上海梅特鲁国际贸易有限公司
31.7653365,上海译恩机械设备有限公司
31.76557466,上海百仕瑞企业管理顾问有限公司
31.76599703,上海嘉斯科分析仪器有限公司
31.76691728,上海德思泰电器有限公司
31.76723993,上海妙文翻译有限公司
31.76941616,上海贝银机电有限公司
31.76943468,上海宽为国际贸易有限公司
31.76969006,上海友森实业发展有限公司
31.76969879,上海德卡金属护栏有限公司
31.77090265X,上海介菱机电设备有限公司
31.77090656,上海飞轩电子有限公司
31.77094068,上海伊高仪器仪表有限公司
31.772146,上海衡臣汽车设备有限公司
31.77244727,上海鸣啸信息科技股份有限公司
31.77287479,上海享亚实业发展有限公司
31.7737094,上海中众弹簧有限公司
31.77372059,上海豪阔建筑装潢设计工程有限公司
31.77455392M,茵卡动力系统（上海）有限公司
31.7746538XR,超润贸易（上海）有限公司
31.7752457,上海霍平实业发展有限公司
31.7752475,上海伊勉特液压器材有限公司
31.77576006,益肯电工器材（上海）有限公司
31.77577229,上海科享机械器材有限公司
31.77577712,羿科安全设备（上海）有限公司
31.77665849,上海华澜电子有限公司
31.77805056X,上海隽博五金机电有限公司
31.778051,上海宗运交通设备有限公司
31.77854382,上海久卓机电设备有限公司
31.77858165,上海肯耐珂萨人力资源科技股份有限公司
31.77867941B,上海申通地铁集团有限公司轨道交通培训中心
31.77931303,上海粤丰文具有限公司
31.77975743,上海昊照贸易有限公司
31.7805528,上海复方机电有限公司
31.78112565,上海凌沪电器有限公司
31.78127992,上海鼎廷交通设备有限公司
31.78153566,上海创景雕塑景观艺术有限公司
31.7818533,上海剑博机电设备有限公司
31.78425735,上海宝华国际招标有限公司
31.78476213,上海屹德机电技术有限公司
31.78517825,上海湃睿信息科技有限公司
31.78541123X,上海倍伺特自动控制设备有限公司
31.78560304,皮尔磁工业自动化（上海）有限公司
31.78585115,丰罗绝缘材料（上海）有限公司
31.78672752,上海华一电器厂有限公司
31.78783575,上海诺霸科技有限公司
31.78785698,上海庞丰机电科技有限公司
31.78939553J,上海占国工贸有限公司
31.78950346,上海凯扬动力设备有限公司
31.78952326,上海友华润滑油销售有限公司
31.7895563,上海珀斯轨道交通设备有限公司
31.79143945,上海福伊特夏固今创车钩技术有限公司
31.79149098,上海上材工程材料检测有限公司
31.79157188P,上海友林机械设备有限公司
31.79274429,倍通贸易（上海）有限公司
31.79274817,昂思菲特贸易（上海）有限公司
31.79276213,上海德伟隆导线有限公司
31.79348248Q,上海威奥玥赫轨道设备有限公司
31.79398050F,上海博阳精讯信息科技有限公司
31.7970226,优伯（上海）企业管理咨询有限公司
31.79705583,上海格姆特紧固技术有限公司
31.79705661,汉萨福莱柯思液压技术（上海）有限公司
31.79894723,上海兴同信物流有限公司
31.80032060N,上海凡凡涂装设备工程有限公司
31.80034788J,上海数捷电气有限公司
31.80043982C,上海道麒实业发展有限公司
31.80073997U,三逢消防设备（上海）有限公司
31.80557407,上海上电机电设备工程有限公司
31.806246,上海策马翻译有限公司
31.80740834,通号通信信息集团上海有限公司
31.81512526,诺霸精密机械（上海）有限公司
31.82076231,启福光照明科技(上海)有限公司
31.82116176B,上海同济技术转移服务有限公司
31.83262961,上海地铁运营有限公司车辆分公司工会职工技术协会
31.83436446,上海控创信息技术股份有限公司
31.84083092,河南省建安防腐绝热有限公司上海豫特防腐绝热分公司
31.8478050X9,上海铭欢贸易有限公司
31.85198909U,德马泰克国际贸易（上海）有限公司
31.85461407G,上海同研城铁减振技术有限公司
31.85465707Q,通标标准技术服务（上海）有限公司
31.86170720E,上海红茶物业管理有限公司
31.8617449X1,柏中紧固件(上海)有限公司
31.86193551J,艾因蒂克科技(上海)有限公司
31.86194802Q,上海契源控制技术有限公司
31.86726996,上海名欧精机有限公司
31.86805235T,信自裕（上海）机械有限公司
31.87337944,上海亮大机电科技有限公司
31.87802962R,马波斯（上海）测量设备科技有限公司
31.87822007F,上海新华传媒连锁有限公司
31.87862392,上海宝亚安全装备股份有限公司
31.87930518,友洽（上海）国际贸易有限公司
31.88683059P,上海茂博汽车零部件有限公司
31.88708698T,上海申际轨道交通设备发展有限公司
31.88733837U,上海鑫雷电气有限公司
31.90158349N,上海丰扬物流服务有限公司
31.9162163,上海华测品标检测技术有限公司
31.91670304G,天田（中国）有限公司
31.91674145L,上海习仁科学仪器有限公司
31.91682145,上海贞观国际贸易有限公司
31.92703539,上海万达国际电影城有限公司
31.92792287N,利纳（上海）质量技术服务有限公司
31.92960781u,上海子越净化科技有限公司
31.92966534,上海卡维文化传播有限公司
31.93637317,北京大生知行科技有限公司上海分公司
31.93853175W,上海轨道交通检测认证（集团）有限公司
31.94153481X,英格尔检测技术服务（上海）有限公司
31.9421587XN,上海彩斯惠标识科技有限公司
31.94517414U,上海汇平化工有限公司
31.95619528,上海宜疆实业有限公司
31.95792613M,上海苏墨电器有限公司
31.95829754W,上海视博文化传播有限公司
31.96411635M,重展（上海）实业有限公司
31.96414641L,中国平安财产保险股份有限公司航运保险运营中心
31.97059412Y,俯峰（上海）机械贸易有限公司
31.97230884C,上海众联能创新能源科技股份有限公司
31.97261488G,上海百集科技集团有限公司
31.97288592B,上海亿道电子技术有限公司
31.98629254G,上海轻鑫起重设备有限公司
31.98734652R,川达供应链管理（上海）有限公司
31.9877260XN,德斯拜思机电控制技术(上海)有限公司
31.98793179A,善准仪表商贸（上海）有限公司
31.98814102,广州奥士达国际物流有限公司上海分公司
31.98931356C,四川拓及轨道交通设备股份有限公司
