编码,名称
2000041321,上海众德机械有限公司
2000041322,宁波市鄞州五乡海鹏超市
2000041323,广州市城市建设档案技术咨询服务公司
2000041324,常熟市和新不锈钢管制造有限公司
2000041398,李松云
2000041399,怀远县恒祥企业管理服务有限公司
2000041443,深圳市恩港科技开发有限公司
2000041444,宁波市特种设备检验研究院
2000041445,宁波市鄞州五乡宏泽门窗店
2000041446,王声君
2000041447,宁波鄞州景煦升商务服务有限公司
2000041482,广州市丰瑞财税顾问咨询有限公司
2000041483,上海英旭机电科技有限公司
2000041484,宁波北仑沃隆环境科技有限公司
2000041485,朗酷（北京）科技有限公司
2000041533,成都衡力磁电科技有限公司
2000041537,乌鲁木齐地铁咨询有限公司
2000041547,China Railway Materials (Australia) Pty Ltd
2000041554,新加坡海关 SINGAPORE CUSTOMS
2000041555,北京大诚弘毅品牌管理咨询有限公司
2000041557,株洲仲裁委员会
2000041558,WAN LIP ENTERPRISE
2000041559,孙玉
2000041560,刘欢
2000041561,宿朝阳
2000041587,湖南国商海畅商务服务有限公司
2000041588,湖北省机电研究设计院股份公司
2000041593,广东本来网电子商务有限公司
2000041594,株洲市中医伤科医院
2000041595,河南省特种设备安全检测研究院洛阳分院
2000041596,高春清
2000041617,深圳采贝教育科技有限公司
2000041618,上海元驰商贸有限公司
2000041645,中国邮政速递物流股份有限公司宁波市分公司洪塘营业部
2000041657,湖南中能达电源科技有限公司
2000041660,中国人寿财产保险股份有限公司宁波市分公司
2000041734,杭州沃镭智能科技股份有限公司
2000041745,湖南建院建设工程设计咨询有限责任公司
2000041746,广州贝龙环保热力设备股份有限公司
2000041747,宁波公运汽车修造有限公司
2000041748,宁波鄞州宁东绿洁家庭服务部
2000041749,乌鲁木齐市天岳天羿电子科技有限责任公司
2000041750,广东省招标投标协会
2000041752,浙江建安工程管理有限公司湖北分公司
2000041786,江苏省青年商会
2000041787,昆山京东尚信贸易有限公司
2000041837,湖南珂拓电子科技有限公司
2000041838,广东优速配技术有限公司
2000041907,湖南比亚工贸有限公司
2000041922,中铁华铁工程设计集团有限公司
2000041941,乌鲁木齐起潮信息科技有限公司
2000041976,采埃孚传动系统（北京）有限公司
2000042007,广州永祥印务有限公司
2000042114,株洲盛慧科技发展有限公司
2000042120,广州市番禺区就业训练中心（广州市番禺区职业技能培训和鉴定指导中心）
2000042121,武汉市昌龙电子电器有限公司星沙分公司
2000042122,上海电气自动化设计研究所有限公司
2000042123,江苏洪鑫新材料科技有限公司
2000042124,宁波海曙棕榈湾餐饮有限公司
2000042126,南通向日亚精密机电科技有限公司
2000042127,大华建设项目管理有限公司湖南分公司
2000042128,广州市谱尼测试技术有限公司
2000042179,宁波市人才服务中心
2000042180,无锡亚舟精机有限公司
2000042193,平阳县博誉文具有限公司
2000042194,宁波市北仑区新矸明晖机电商行
2000042195,宁波市鄞州岐海环保咨询服务有限公司
2000042196,宁波宏博环保科技有限公司
2000042197,广州快旺贸易有限公司
2000042215,深圳远岸科技有限公司
2000042216,湖南汇虹试剂有限公司
2000042217,安美科技股份有限公司
2000042218,龙川县远景实业发展有限公司
2000042219,中环信环保有限公司
2000042309,上海锐普广告有限公司
2000042310,湖南米得银铁路专用设备制造有限公司
2000042311,洛阳和玺物资回收有限公司
2000042312,湖北玉立砂带集团股份有限公司
2000042326,株洲市星火燎原商贸有限公司
2000042373,广西中石化南宁石油有限公司
2000042374,云南省交通投资建设集团有限公司
2000042375,株洲市中通快递有限公司
2000042376,武汉凯恩德环保科技有限公司
2000042377,上海逸发商务咨询有限公司
2000042378,湖北省信产通信服务有限公司科技咨询分公司
2000042379,杭州易泰达科技有限公司
2000042380,南京软核科技有限公司
2000042381,广州市番禺环境工程有限公司
2000042382,铁汉环保集团有限公司
2000042403,沈阳恒久安泰智能制造与机器人系统技术有限公司
2000042404,四川广正科技有限公司
2000042405,北京君恒知识产权代理事务所（普通合伙）宁波分所
2000042406,杭州帕蒂科技有限公司
2000042461,武汉华工后勤管理有限公司
2000042462,云南中会教育信息咨询有限公司
2000042493,宁波博意文化创意有限公司
2000042494,湘乡市平平机械制造有限公司
2000042495,湘乡市城东铸造有限公司
2000042496,长沙和诚再生资源有限公司
2000042497,湖南省旭光再生资源有限公司
2000042498,湖南新曙光铸造有限公司
2000042499,湖南奥达电气科技有限公司
2000044318,湖南凌瑞建设工程有限公司
2000044327,广州灵犀广告有限公司
2000044328,武汉市忠汇节水科技有限公司
2000044329,杨丽娟
2000044330,宁波德业日用电器科技有限公司
2000044331,永恒力叉车（上海）有限公司广州分公司
2000044332,北诚（北京）国际展览有限公司
2000044355,国家知识产权局专利局长沙代办处
2000044375,株洲市大丰物流有限公司
2000044410,浙江苏强格液压股份有限公司
2000044412,万宗网络科技（上海）有限公司
2000044413,杭州禾迈电力电子股份有限公司
2000044415,湖南麦哲伦少儿体育科技有限公司
2000044416,长沙嘉鹏机械设备有限公司
2000044417,宁波鄞州冠权电脑有限公司
2000044425,BIZCLIK MEDIA LIMITED
2000044426,深圳市环通认证中心有限公司
2000044429,靖江市法斯特传动部件科技有限公司
2000044438,淮安辰宇电力设备有限公司
2000044527,株洲博雅实业有限公司
2000044529,常州超声电子有限公司
2000044530,中国电信股份有限公司鄞州分公司
2000044532,长沙市新烨文化传播有限公司
2000044533,武建军
2000044538,宁波市鄞州圣纬金属制品有限公司
2000044539,洛阳市瀍河区精品书屋
2000044591,江苏东工合金有限公司
2000045861,蔡俊峰
2000045862,新疆天汇南源汽车销售服务有限责任公司
2000045863,深圳市双平电源技术有限公司
2000045911,湖南湘成厨具设备有限公司
2000045915,湖南省惠捷物流有限公司
2000045916,湖南湘资运物流有限公司
2000045960,新疆涌泽汽车销售服务有限公司
2000045961,长沙恩楷企业咨询有限公司
2000045978,中科院广州电子技术有限公司
2000045988,深圳市恒翱科技有限公司
2000046000,湖南龙武工程项目管理有限公司
2000046001,柯派斯密封系统（大连）有限公司
2000046003,广州品鑫机电科技有限公司
2000046004,株洲阿拉法自动化科技有限公司
2000046005,广州天轶清洁服务有限公司
2000046006,广州市鑫瑞物业管理有限公司
2000046066,瑞安市拓海汽车部件有限公司
2000046068,武汉荣耀发企业管理咨询有限公司
2000046069,宁波金博交通设施有限公司
2000046070,河南果壳文化传媒有限公司
2000046113,JYS INTERNATIONAL
2000046115,广州市金德利机电设备有限公司
2000046116,洛阳市西工区逸冉纺织品商行
2000046251,盐城康华瑞健康管理有限公司综合门诊部
2000046293,广州市岭南建筑研究中心
2000046294,东莞市高飞电子科技有限公司
2000046295,河北省电子认证有限公司
2000046365,深圳市英大科特技术有限公司
2000046366,宁波俊达机电设备有限公司
2000046368,洛阳市留祥商贸有限公司
2000046391,西平县超远物流有限公司
2000046435,广东机械进出口通用机械有限公司
2000046438,江苏中安索具有限公司
2000046443,株洲市润恒机电设备有限公司
2000046457,湖南省新华书店有限责任公司长沙市分公司
2000046492,湖南捷鑫科技发展有限公司
2000046497,深圳市中腾建业建设投资有限公司
2000046527,广州庄园园林绿化装饰工程有限公司
2000046528,广东锦源汇智车辆技术有限公司
2000046529,宁波千盛供应链管理有限公司
2000046530,北京中检维标企业管理咨询有限公司
2000046567,隔而固（青岛）振动控制有限公司
2000046625,河北网星软件有限公司
2000046629,盐城中大汽车服务有限公司
2000046630,盐城市博奥宾馆有限公司
2000046631,广州市誉基机械设备有限公司
2000046632,宁波鄞州新城博汇图文设计服务部
2000046637,广东天章信息纸品有限公司
2000046638,宁波豪丽源金属制品有限公司
2000046669,吉林启星铝业有限公司
2000046685,湖南中特物流有限公司
2000046686,北京亿聚力科技发展有限公司
2000046692,长沙天恒测控技术有限公司
2000046693,合肥井松智能科技股份有限公司
2000046701,深圳市鑫沃德科技有限公司
2000046714,盐城市轩宇广告有限公司
2000046715,盐城市城南新区熠熠烟酒商行
2000046723,钟祥东弹汽车零部件有限公司
2000046724,华夏人寿保险股份有限公司盐城中心支公司
2000046737,中国科学院新疆生态与地理研究所
2000046750,湖南四建安装建筑有限公司
2000046751,宁波屹诺电子科技有限公司
2000046752,杭州韦诺科技有限公司
2000046753,北京深蓝海域信息科技有限公司
2000046756,上海华测品正检测技术有限公司
2000046757,沧州渤海新区德诚物流有限公司
2000046758,江苏维川科技有限公司
2000046776,厦门得佳电子科技有限公司
2000046777,宁波智翔信息技术有限公司
2000046778,广西悦尔达贸易有限公司
2000046779,温州市质量技术监督检测院
2000046780,长沙三能文化传播有限公司
2000046825,株洲思之创交通科技有限公司
2000046866,中国华西工程设计建设有限公司
2000046868,株洲顺一物流有限公司
2000046869,株洲达安货运有限责任公司
2000046870,株洲市湘江资源运营管理有限公司
2000046871,中建五局第三建设有限公司
2000046872,株洲达安建材实业有限公司
2000046873,株洲市华冠明成贸易有限公司
2000046874,株洲中铁电气物资有限公司
2000046875,桐城市中石大里程电器有限公司
2000046876,武汉万龙和劳务有限公司
2000046877,株洲中南顺畅物流实业有限公司
2000046878,株洲港有限公司
2000046879,洛阳西曌建筑工程有限公司
2000046880,株洲市博朗贸易有限公司
2000046881,贵州省岑巩县天源冶炼有限责任公司
2000046882,广州新华书店企业集团音像发行有限公司
2000046883,广州广益制冷设备安装有限公司
2000046884,广州泰通空调设备有限公司
2000046885,宁波市鄞州五乡昊森木制品厂
2000046886,江苏塔菲尔新能源科技股份有限公司
2000046887,肇庆市新荣昌环保股份有限公司
2000046888,无锡佳宇机械制造厂
2000046926,华侨大学
2000046937,国电物资集团有限公司电子商务中心
2000046982,成都运达轨道交通技术服务有限公司
2000046989,沧州渤海新区港晟百货商行
2000046990,常州市惠发特机械有限公司
2000046991,洛阳市轨道交通集团有限责任公司
2000046992,宁海鸿创金属制品有限公司
2000046993,宁波天木工程设计有限公司
2000046994,中华联合财产保险股份有限公司新疆分公司营业部
2000046995,广东粤建设计研究院有限公司
2000047008,济南思达测试技术有限公司
2000047009,正略钧策集团股份有限公司
2000047010,宝视纳视觉技术（北京）有限公司深圳分公司
2000047011,广州市谐程电气设备有限公司
2000047012,金华新马汽车配件有限公司
2000047013,贾宝林
2000047014,广东华凯电梯有限公司
2000047015,沃克斯电梯（中国）有限公司
2000047016,广州森兰信息技术有限公司
2000047017,广州金钥匙财税咨询有限公司
2000047018,拓慧管理咨询（深圳）有限公司
2000047045,北京君发家具有限公司
2000047046,全兴精工集团有限公司
2000047058,湘潭大学
2000047068,深圳市华光行电工器材有限公司
2000047069,新疆华科天宇检测技术有限公司
2000047070,新疆锦芮矿业有限公司
2000047071,中检集团福建康泰测试评价技术有限公司新疆分公司
2000047082,杭州沐风商务信息咨询有限公司
2000047093,江苏中车城市交通装备有限公司工会委员会
2000047099,阿尔法起重机有限公司
2000047105,南京乐富文化传媒有限公司
2000047129,南京苏正科技实业有限公司
2000047130,上海密京工业设备有限公司
2000047137,康德瑞恩电磁科技（中国）有限公司
2000047139,杭州昌美贸易有限公司
2000047156,中铁一局集团新运工程有限公司
2000047180,上海新世纪检验认证有限公司
2000047191,广西能森建筑工程有限公司
2000047208,中国人民财产保险股份有限公司湖南省分公司
2000047209,广州市中报兴图软件科技有限公司
2000047210,昆明高海拔电器检测有限公司
2000047211,宁波鄞州宁东百陶汇酒店用品商行
2000047247,广州龙新印章有限公司
2000047248,广州市弘宇科技有限公司
2000047249,北京国安轨道交通科技有限公司
2000047259,广州市通赢计算机有限公司
2000047324,长沙宏柯机械销售有限公司
2000047325,新疆一蒙力威环保设备有限公司
2000047382,上海扬子国际旅行社有限公司
2000047405,中国铁路兰州局集团有限公司后勤保障服务中心
2000047411,"HANWHA TOTAL PETROCHEMICAL CO.,LTD"
2000047412,周雷军
2000047426,新疆钰佳环保科技有限公司
2000047448,湖南史志文化传播有限公司
2000047472,株洲洁净煤股份有限公司
2000047473,陶氏化学太平洋（新加坡）私人有限公司
2000047474,北京国信创联信息咨询中心
2000047475,中铁二十五局集团第三工程有限公司
2000047476,SABIC ASIAN PACIFIC PTE LTD
2000047477,株洲力滔贸易有限公司
2000047478,甘肃酒钢天成彩铝有限责任公司
2000047479,湖南天桥律师事务所
2000047480,湖南方正圆律师事务所
2000047481,湖南万事运通供应链有限公司
2000047482,昆明皖合力叉车有限公司
2000047483,深圳市智立行企业管理咨询有限公司
2000047484,上海赫梅尼自动化设备有限公司
2000047485,宁波东科客运有限公司
2000047486,南德商品检测（上海）有限公司
2000047487,东莞市景恩锐实业有限公司
2000047488,株洲全和信息科技有限公司
2000047490,广州冠粤信息科技有限公司
2000047491,三一海洋重工有限公司
2000047517,聚光科技（杭州）股份有限公司
2000047540,美恺香港有限公司
2000047541,中国铁路哈尔滨局集团有限公司质量技术监督所
2000047542,益达国际有限公司
2000047543,湖南中瑞环保科技咨询服务有限公司
2000047544,丹阳市合盈汽车部件有限公司
2000047570,厦门思博城展览展示服务有限公司
2000047622,山西合瑞通晨招标代理有限公司
2000047623,长沙研诺电气设备有限公司
2000047624,无锡大家广告有限公司
2000047625,无锡壹米文化传播有限公司
2000047626,佛山国科科丽宝橡胶制品有限公司
2000047627,深信服科技股份有限公司
2000047628,上海睿华信息科技有限公司
2000047629,新疆艺锦源生态建设有限公司
2000047662,宁波轩银智能装备工程有限公司
2000047663,中国工业设计协会
2000047664,武汉市炜源物资有限公司
2000047665,西安华讯得贸易有限公司
2000047666,武汉聚彩成艺文化传播股份有限公司
2000047667,长沙京东厚成贸易有限公司
2000047668,武汉浦江欣诚商贸有限公司
2000047687,湖南亦格广告策划有限公司
2000047719,上海适航航空技术有限公司
2000047720,北京腾实信科技股份有限公司
2000047721,南宁龙欣海汽车用品有限公司
2000047731,广州地铁（佛山）地铁金融城酒店管理有限公司
2000047767,上海流利说信息技术有限公司
2000047775,盐城聚嘉文化传媒有限公司
2000047776,北京市奋迅律师事务所
2000047777,华夏人寿保险股份有限公司江苏分公司
2000047778,新疆有色冶金设计研究院有限公司昌吉市北京路分公司
2000047779,广西华联综合超市有限公司南宁江南分公司
2000047780,湖北四海同方技术股份有限公司
2000047781,广东仕伯特地面材料有限公司
2000047782,广州市隽欣智能科技有限公司
2000047783,工业和信息化部工业文化发展中心
2000047882,上海信聚信息技术有限公司
2000047893,武汉市梁子湖茶叶有限公司
2000047990,张春盈
2000047991,广州粤洋机械设备有限公司
2000047992,广州双木机械设备有限公司
2000047993,广州齐心共赢办公用品有限公司
2000048008,University of Southampton
2000048014,Sun Studio Strojirenstvi s.r.o
2000048020,湖南省知识产权信息服务中心
2000048021,中车集团株洲车辆厂科协科技咨询服务部
2000048022,周正印
2000048023,湖北建新市政工程有限公司
2000048024,株洲隆宇铝业有限公司
2000048025,湖南锐好电梯有限公司
2000048026,中铝西南铝冷连轧板带有限公司
2000048027,新疆吉安顺建设工程有限公司
2000048100,湖南米乐传媒有限公司
2000048133,福斯特（广州）新材料科技有限公司
2000048134,上海勤合焊接技术发展有限公司
2000048135,宁波西阳之星酒店用品有限公司
2000048136,广东国众联行资产评估土地房地产估价规划咨询有限公司
2000048137,广州阜航文化传播有限公司
2000048138,盛隆电气集团电力工程有限公司
2000048139,武汉龙鑫达盛科技有限公司
2000048140,新疆中进通达汽车服务有限公司
2000048159,上海询诺通信科技发展有限公司
2000048160,北京中控博业科技发展有限公司
2000048161,北京鸿时康铭科技发展有限责任公司
2000048162,成都威布尔科技有限公司
2000048169,昆明市晋宁区晋城镇财政所代管资金专户
2000048188,醴陵市新太阳国际大酒店管理有限公司
2000048224,彭英汉
2000048225,郑州煊烨电子科技有限公司
2000048226,广州佰德机电设备有限公司
2000048227,朱红
2000048228,上海工程技术大学
2000048235,中路轨道设备（常熟）有限公司
2000048263,武汉远冠科技有限公司
2000048275,佛山市南海区铭兴桶装水店
2000048291,湖南纯盛新材料有限责任公司
2000048294,乌鲁木齐市灏淼昇工程服务有限公司
2000048295,通用电梯股份有限公司
2000048296,苏州帝奥电梯有限公司
2000048297,北京和君咨询有限公司
2000048298,浙江赛宁电子工贸有限公司
2000048310,云南杨林工业开发区汕滇药业有限公司
2000048311,乌鲁木齐市九九世纪门控设备有限公司
2000048312,湖南湘东贸易有限公司
2000048314,西安易达汇鑫电气自动化有限公司
2000048315,花垣县十八洞村戴雅苗族刺绣有限公司
2000048316,开物成务文化科技（深圳）有限公司
2000048317,中国平安财产保险股份有限公司云南分公司
2000048347,天健会计师事务所(特殊普通合伙)北京分所
2000048382,南京康曼电子科技有限公司
2000048385,广西鑫广达博通汽车销售服务有限公司
2000048386,上海涵勋自动化设备有限公司
2000048387,宁波市江北大邳五金商行
2000048388,浙江竹林人家餐饮有限公司宁波鄞州宏泰分公司
2000048389,杭州玖迈网络科技有限公司
2000048390,昆山佰奥智能装备股份有限公司
2000048392,株洲钧诚精密制造有限公司
2000048403,广州市冠恩电子科技有限公司
2000048404,株洲市芦淞区俏佳人艺术影楼
2000048405,《劳动保护》杂志社
2000048407,杭州储能科技有限公司
2000048408,洛阳乾贞商贸有限公司
2000048429,重庆模迪易成科技有限公司
2000048431,武汉泰平安防机电设备有限公司
2000048436,株洲立德教育咨询有限公司
2000048437,株洲九方一和科贸有限公司
2000048438,宁波四明化工有限公司
2000048484,青岛立坤木业有限公司
2000048507,和致众成（北京）科技有限公司
2000048520,武汉振雄大件物流有限公司
2000048529,湖南华创交通装备有限公司
2000048530,中铝洛阳铜加工有限公司
2000048531,宁波鼎邦企业管理咨询有限公司
2000048532,宁波市江北朱杰蔬菜批发部
2000048533,宁波市北仑鸿安包装有限公司
2000048545,广州和粤人力资源有限公司
2000048561,中钢集团武汉安全环保研究院有限公司
2000048564,沧州市中盛晖腾商贸有限公司
2000048565,沧州市慕唯文化传播有限公司
2000048566,盐城市城南新区兰园酒店
2000048579,湖南知云无人机科技有限公司
2000048580,盐城市亭湖区启缘广告经营部
2000048582,武汉兴之晟机械制造有限公司
2000048645,湖南建材地质工程勘察院有限公司
2000048646,湖南景翌湘台环保高新技术开发有限公司
2000048662,龚磊
2000048664,宁波英诺威德自动化科技有限公司
2000048665,新疆阡陌视频文化传媒有限公司
2000048675,苏州苏凯捷企业管理咨询有限公司
2000048676,刘鸿雁
2000048685,衡阳安美安防科技有限公司
2000048695,江西京九物流有限责任公司
2000048702,广东省安全生产技术中心有限公司
2000048703,硕达(上海)国际货运有限公司
2000048704,昆明博鳌纵横网络科技有限公司
2000048731,湖南天九商贸有限责任公司
2000048765,宁波三晖环保科技有限公司
2000048766,东莞市山河环保科技有限公司
2000048767,佛山市技胜智能设备有限公司
2000048768,新乡市安能滑导电器厂
2000048769,浙江多谱检测科技有限公司
2000048770,登封市鼎锐磨料磨具有限公司
2000048771,新疆天合环境技术咨询有限公司
2000048772,常州瑞德丰精密技术有限公司
2000048773,株洲市物流与采购联合会
2000048774,广西桂海天律师事务所
2000048793,南宁国美电器有限公司
2000048794,株洲全日顺贸易有限公司
2000048795,东莞市诚丰包装材料有限公司
2000048796,广东平正招标采购服务有限公司广州分公司
2000048920,中共株洲市委组织部
2000048921,宁波胜达高科智能系统工程有限公司
2000048922,宁波市伟安保安服务有限公司
2000048923,宁波天网保安服务有限公司
2000048937,广州朋高劳保用品有限公司
2000048938,深圳中车轨道车辆有限公司
2000048941,上海仰拓轨道交通科技有限公司
2000048955,宁波安全三江工程咨询招标代理有限公司
2000048960,湖南腾旺环保科技有限公司
2000048969,沧州渤海新区创新广告服务部
2000048970,北京银湖富峰商贸有限公司
2000048971,湖南华菱电子商务有限公司
2000048972,黑龙江鑫达企业集团上海新材料销售有限公司
2000048973,广州市家豪办公设备有限公司
2000048974,南宁市锰辉聚建材有限公司
2000048975,华蓝设计（集团）有限公司
2000049006,湖南冠卓科技有限公司
2000049007,上海华信中贸重工有限公司
2000049008,上海亚卡黎实业有限公司
2000049009,长沙市芙蓉区艺雕石材商行
2000049010,广西冠泽电气有限公司
2000049012,洛阳市禹风物流有限公司
2000049013,淮北津奥铝业有限公司
2000049014,广东铁峰信息技术有限公司
2000049125,广州圆坤贸易有限公司
2000049131,长沙磐然商贸有限公司
2000049132,湖南标普信息科技有限公司
2000049151,湖南乐众联创网络科技有限公司
2000049165,盐城市通达汽车修理有限公司
2000049166,北京圣予浩培管理顾问有限公司
2000049187,广东省设备监理协会
2000049188,中华人民共和国大连海关
2000049232,武汉新天宇建设工程有限公司
2000049233,上海创萤包装设备有限公司
2000049242,株洲市石峰区颂宴酒楼
2000049243,广州莱茵商业信息咨询服务有限公司
2000049244,广州市番禺区慈善会
2000049309,北森云计算有限公司
2000049310,湖南贝克特环保科技有限公司
2000049354,南宁市车友缘进口汽车维修有限责任公司
2000049355,长沙潘森文化传播有限公司
2000049356,深圳冀润投资发展有限公司
2000049357,洛阳市全家福健身器材有限公司
2000049358,宁波众拓集装箱科技有限公司
2000049359,宁波森豪起重装卸有限公司
2000049360,株洲振嘉工贸有限公司
2000049376,江苏弘恒电气有限公司
2000049389,盐城卡迪创艺酒店有限公司
2000049447,博纳检测认证有限公司
2000049448,昆山精纳检测技术有限公司
2000049451,华安财产保险股份有限公司株洲中心支公司
2000049479,新疆国检检测集团有限公司
2000049480,上海中车瑞伯德智能系统股份有限公司株洲分公司
2000049484,南京红色文化培训中心
2000049532,洛阳智酷企业管理咨询有限公司
2000049533,ALSTOM Transport (S) Pte Ltd
2000049534,株洲市荷塘区人民法院
2000049535,北京国机联创广告有限公司
2000049539,湖南省株洲市中级人民法院
2000049540,湖南哼哈兄弟文化传媒有限公司
2000049562,挪华威企业管理服务（上海）有限公司
2000049563,湖南叁拾伙伴信息科技有限公司
2000049564,新华三技术有限公司
2000049565,苏州市乐测检测技术服务有限公司
2000049597,北京禹辉净化技术有限公司
2000049622,云南金幂方商贸有限公司
2000049623,昆明锅炉有限责任公司
2000049624,北京联瑞联丰知识产权代理事务所（普通合伙）重庆分所
2000049625,佛山市康贝可机电设备有限公司
2000049626,武汉市开元永业工贸有限公司
