编码,名称
33.67769096,宁波永一包装科技有限公司
33.67769934,宁波国创机车装备有限公司
33.68074741,海宁永大电气新材料有限公司
33.6810544,宁波市江东意铖五金机电有限公司
33.68229320F,液化空气（浙江）有限公司
33.68231316,杭州康达工具有限公司
33.68273364F,苏州润田洁净技术公司
33.6842781,宁波市鄞州和风制冷设备有限公司
33.68428875,宁波江北甬力叉车有限公司
33.68429297,宁波市镇海久久电烙铁厂
33.68475233N,宁波市江东威雅轮胎有限公司
33.68484236Y,宁波市江北洋市废旧金属回收有限公司
33.68485271X,宁波甬宁苏宁云商商贸有限公司
33.68497344B,宁波市北仑乾林塑业有限公司
33.68497926L,宁波杰博人力资源有限公司
33.68506666W,宁波市镇海罗诚起重运输有限公司
33.68516143B,宁波市绿盛菜篮子商品配送有限公司
33.68528945N,宁波海越机电工业有限公司
33.68535002L,余姚市展欣汽车部件有限公司
33.6853894,联邦快递（中国）有限公司宁波分公司
33.68665413L,浙江建安检测研究院有限公司
33.68668148,魏德曼电力绝缘科技（嘉兴）有限公司
33.68758667,浙江瀚邦环保科技有限公司
33.68779045B,浙江硕维新能源技术有限公司
33.68786746X,温岭市锦峰汽车销售服务有限公司
33.68801987,宁波天盛叉车有限公司
33.69136836,宁波市鄞州宏烨消防检测有限公司
33.69138752,宁波江东慧祥文体用品有限公司
33.69167611E,磐安县鸿翔塑胶制品厂
33.69455751,杭州鼎致贸易有限公司
33.69508432,宁波江东亿号装饰工程有限公司
33.69700744,温州市鑫泰紧固件有限公司
33.69820334,宁波钢导办公家具有限公司
33.69822553,宁波江东豪冠工控电子有限公司
33.69824839X,宁波市江北铭记五交化有限公司
33.69980956,杭州诺邦机械有限公司
33.69984755,杭州德凯认证有限公司
33.70009026T,杭州电子科技大学
33.70420469,浙江世贸装饰股份有限公司
33.70420799,浙江嘉控电气股份有限公司
33.70471362,浙江金字机械电器股份有限公司
33.70471374,浙江永贵电器股份有限公司
33.70480941,浙江一舟电子科技股份有限公司
33.70484985,宁波东方加热设备有限公司
33.70488185,三江购物俱乐部股份有限公司
33.70488412,宁波宁力高强度紧固件有限公司
33.70489702,宁波市东南机电设备有限公司
33.70519891,宁波北仑美缔广告传媒有限公司
33.70525247P,宁波凌珂纺织实业有限公司
33.70528464H,浙江明安工程管理有限公司
33.7054159,浙江朗通家具股份有限公司
33.70621260A,杭州亮通网络工程有限公司
33.70816253,镇江市京口区华丰消防器材装备服务中心
33.71114343,史赛飞
33.71207635U,银信（宁波）资产评估有限公司
33.71213007P,宁波市江北恒信税务师事务所（普通合伙）
33.71214843J,宁波都雅装饰工程有限公司
33.71226764,宁波大榭开发区誉达五金机电有限公司
33.71231205F,宁波江东兆亿弱电工程有限公司
33.71240048L,宁波保诚电气有限公司
33.7125053,海盐管件制造有限公司
33.71253113,瑞安市丰泰绝缘材料制品厂
33.71256247,浙江众合科技股份有限公司
33.71259946,海盐凯恩特电器有限公司
33.71330354,宁波天生密封件有限公司
33.71331910X,宁波高发汽车控制系统股份有限公司
33.71337028X,宁波市跃业机电物资有限公司
33.71337472,宁波市兴欣汽车销售服务有限公司
33.71339826,金蝶软件（中国）有限公司宁波分公司
33.71457645,杭州中车车辆有限公司
33.71480566Y,宁波瑞德特功能材料有限公司
33.71545044,杭州胜达钢结构制造有限公司
33.7166858,宁波市江北闽顺电器商行
33.71723222,宁波市天天航空票务有限公司
33.71728502,宁波市江东久隆轴承机电有限公司
33.71761046,浙江省成套招标代理有限公司
33.71761252,中国移动通信集团浙江有限公司宁波分公司
33.71768012X,绍兴县航绍电连接器有限公司
33.71954348,浙江浦江浦华净化设备有限公司
33.72046969,中国石油天然气股份有限公司浙江宁波销售分公司
33.72047892,宁波市江东永一包装材料供应站
33.72047965,宁波梅琪不锈钢制品有限公司
33.72105416,浙江金昌弹簧有限公司
33.721461X02,宁波市鄞州五乡御车房汽车美容养护中心
33.72328495M,宁波永圣条码设备有限公司
33.72328858G,宁波长天计算机科技有限公司
33.72342852N,宁波永耀招标咨询有限公司
33.724089,宁波时代紧固件制造有限公司
33.72409038X,宁波新银利厨设备工程有限公司
33.72409357,宁波正源税务师事务所有限公司
33.72409608,宁波雅戈尔服饰有限公司余姚分公司
33.72454943,中瑞电气有限公司
33.72523853,浙江南都电源动力股份有限公司
33.72638671,宁波海达汽车销售服务有限公司
33.72658678,浙江日发数码精密机械股份有限公司
33.72660343,仙居县兴洲密封件厂
33.72760211,嘉兴市加控电气设备制造有限公司
33.72811173,宁波市海曙众汇食品机械有限公司
33.73014254,宁波光大旅游有限公司
33.73015077,宁波高新区东升科技发展有限公司
33.73163766,宁波顺迪环保工程有限公司
33.73209234,宁波市鄞州区测绘院
33.73210063X,宁波威远会计师事务所有限公司甬江分所
33.73211984,宁波国良物资供应站
33.7321344,宁波光大航空票务有限公司
33.73319562,杭州佳合流量仪表厂
33.73426487,宁波三龙电气有限公司
33.7342818,宁波胜达高科信息工程有限公司
33.73552035,杭州金森科技有限公司
33.73564529P,华茗设计集团有限公司
33.73569004T,杭州市行政审批服务管理办公室
33.7357847X8,杭州锅炉设备安装有限公司
33.73660305Y,宁波市江北明明仪表玻璃厂
33.73660997K,宁波海曙百分百电子科技有限公司
33.7366404XD,宁波美之达家具有限公司
33.73672752X,宁波保税区西恩福贸易有限公司
33.73675583,宁波凌珂新材料科技有限公司
33.7367714XC,宁波江北千米网络科技有限公司
33.73688105,宁波绿诚节能科技有限公司
33.73696078,宁波海天精工股份有限公司
33.7392129,飞鹏车辆配件有限公司
33.73946984,宁波市海曙金茂电器有限公司
33.73957384,杭州先略投资咨询有限公司
33.73973675M,杭州世贸君亭华闰酒店有限公司
33.73992331P,浙江华神消防科技有限公司
33.74215373,象山金丰模业有限公司
33.74217732,宁波市鄞州中升房地产测绘有限公司
33.74291135,杭州万邦工业设备有限公司
33.74323793,杭州蔡琪汽车用品有限公司
33.74346569,浙江梅泰克诺新型建筑板材有限公司
33.74495139,宁波腾翔信息系统工程有限公司
33.74498939,中国平安财产保险股份有限公司宁波分公司
33.74498983,宁波正平信息技术有限公司
33.74499385,中国电信股份有限公司鄞州分公司
33.74499789,余姚市振华灯具商行
33.74499872,宁波海曙中真真空泵配件机械厂
33.74585302X,宁波安信保安服务有限公司
33.74632064,兴乐集团有限公司
33.74703141,杭州南都电源销售有限公司
33.74712224,宁波保税区嘉熙电气有限公司
33.74713912,宁波市鄞州都彩保洁服务有限公司
33.74718916T,宁波北仑鼎隆钢结构安装有限公司
33.74725682,宁波康展国际贸易有限公司
33.74728022D,宁波中聘信息科技股份有限公司
33.74731061Q,宁波市江北金亮绿色再生物资回收有限公司
33.74736125,宁波市大虹贸易有限公司
33.74771644,温州欧舒特猛狮汽车有限公司
33.74913427,宁波鸿宇俽瑞信息科技有限公司
33.74927108R,宁波市鄞州盛飞专利代理事务所（特殊普通合伙）
33.74930876R,宁波英普瑞特供应链管理有限公司
33.74940856,宁波市江北新兴申通快递有限公司
33.74954488X,宁波市恒乐装饰设计有限公司
33.75032515D,宁波浙江国美电器有限公司
33.75035312,宁波海曙科电工贸有限公司
33.75038588,宁波金牛椅业有限公司
33.75115281,瑞安市赛巨汽车电器有限公司
33.75191109,温州佳兴皮具文具有限公司
33.75191785,浙江万丰金马逊科技有限公司
33.75326977,宁波经纬汽车贸易有限公司
33.75594816,浙江联强数控机床股份有限公司
33.75628693,上海振华国际船务代理有限公司
33.75628772,宁波市融资担保有限公司
33.75629895,宁波市鄞州正诚建设工程检测有限公司
33.75643089,苏州市精工冷气工程有限公司
33.75888052,宁波柯美系统集成有限公司
33.75952384,杭州合力叉车销售有限公司
33.75959162,上海金广电气有限公司
33.7601949,浙江中航电子有限公司
33.76147147,宁波嘉劲电子科技有限公司
33.76147792X,宁波海耀机械制造有限公司
33.7615861,浙江盾安机电科技有限公司
33.76450938,宁波江北倍耐橡塑有限公司
33.76452461,宁波合鑫标准件有限公司
33.76453296,宁波市北仑区大矸雄风机械厂
33.76453463,宁波市江北明腾电脑有限公司
33.76820621,浙江怡华工业设备有限公司
33.7685206,宁波建工股份有限公司
33.76854697,宁波市科翔工程项目管理有限公司
33.76854801,宁波江东高兰特焊接科技有限公司
33.77084015,杭州联拓贸易有限公司
33.7719093,缙云县协力机床工具有限公司
33.77204519X,宁波市鄞州高桥振海石油液化气有限公司
33.77231367,宁波三特胶粘制品有限公司
33.77232766,宁波协合劳务有限公司
33.77233929,宁波寰球安全科技有限公司
33.7731009,浙江甬泰律师事务所
33.77310935G,杭州迈斯嘉电子科技有限公司
33.77359161,杭州松井电器有限公司
33.77647510X,宁波诺丁汉大学
33.77656088,宁波浙保安全防护用品有限公司
33.7767199XU,宁波市鄞州和谐安全生产技术咨询服务有限公司
33.77695377Y,宁波海曙恒飞电子有限公司
33.77721467,浙江步森服饰股份有限公司
33.7773229XT,浙江瑞昭科技股份有限公司
33.77821478X,宁波市鄞州维锋纸箱厂
33.77824835,宁波市江北杰品包装材料公司
33.7790311,浙江报喜鸟服饰股份有限公司
33.77928809,浙江齐治科技有限公司
33.77929481,杭州图软科技有限公司
33.78040611,宁波海曙赛诺网威网络技术有限公司
33.7804194XU,宁波市江东耐高清洁设备有限公司
33.78043033,宁波市润明电子科技有限公司
33.78043092,宁波金丰汽车销售服务有限公司
33.78204822,九峰海洋生态建设集团有限公司
33.7821478XW,宁波市海曙维锋纸箱厂
33.78238829P,宁波凯力空调设备有限公司
33.78239724,浙江全通汽车维修有限公司
33.78431211X,宁波华研节能环保安全设计研究有限公司
33.78432399,宁波翼虎加成物流服务有限公司
33.78434418,宁波江东勇祥制冷设备有限公司
33.78567467x,通标标准技术服务有限公司安吉分公司
33.78676042,宁波市科技园区欧林德家具有限公司
33.78678132X,宁波市鄞州埃珂锡业有限公司
33.78679967,奉化市王江塑料五金厂
33.78772483,浙江环科院有限责任公司
33.78968751,浙江纵驰环境科技有限公司
33.790087,宁波江东鑫隆中宏轴承有限公司
33.79008833,欧琳集团有限公司
33.79091837,杭州深腾信息技术有限公司
33.79096716X,创奇科技有限公司
33.79099163,浙江浙大网新众合轨道交通工程有限公司
33.79200047Y,宁波海曙甬视金桥文化传媒有限公司
33.79208727H,宁波英勒维特自动化科技有限公司
33.7921959X2,宁波市水务环境集团有限公司
33.79231572E,宁波鄞州琪嘉电脑科技有限公司
33.79285811R,奥展实业股份有限公司
33.79301992,宁波市镇海金莉花机械电器制品厂（普通合伙）
33.79304094,宁波正工成套电器有限公司
33.79304632,宁波市鄞州明和冷暖设备工程有限公司
33.79333130K,杭州德铁企业管理咨询有限公司
33.79365152,杭州金恒电源科技有限公司
33.7936823,杭州金东气体设备有限公司
33.7964742,微宏动力系统（湖州）有限公司
33.79857220X,浙江理想门业制造有限公司
33.79950955,宁波江东三秦机电设备有限公司
33.79952011,宁波市鄞州广茂电器有限公司
33.79953645,宁波索力特复合材料有限公司
33.79963013,浙江金桥铜业科技有限公司
33.80270414F,华设设计集团股份有限公司
33.80408364W,宁波威远工程造价咨询有限公司
33.80422131T,宁波依格赛特服饰有限公司
33.80444868,宁波海曙百特广告策划有限公司
33.80516811P,宁波高新区盈甬贸易有限公司
33.80519502R,宁波江东厚林机械设备有限公司
33.80523245,宁波市江北世裕锯业有限公司
33.80565836F,台州市聚焦贸易有限公司
33.80706137,浙江华邦物联技术股份有限公司
33.81051902A,宁波江东千华贸易有限公司
33.81208034,李磊
33.81694824D,浙江国检检测技术股份有限公司
33.81805388R,嘉兴安瑞卡环保设备有限公司
33.82909376,杭州纽蓝科技有限公司
33.83950103F,宁波标普企业管理咨询有限公司
33.83950787A,浙江奇祥自动化设备有限公司
33.83960790Y,浙江中通检测科技有限公司
33.83962316,宁波鑫禹泰机器人科技有限公司
33.83976696D,宁波通宜包装制品有限公司
33.83993162B,宁波海跃税务师事务所有限公司
33.84256947,宁波安全三江会计师事务所有限公司
33.842687,宁波赛诺机械有限公司
33.84282634B,浙江福正汽配有限公司
33.84290853Y,宁波鄞州咏卿仪表有限公司
33.84408496,宁波经济杂志社
33.84537321,永嘉县冶金机电设备一厂
33.84552627,乐清市求精车辆配件厂
33.8458742D4,宁波润泽建筑装饰有限公司
33.84750115,宁波市鄞州锐迪塑胶有限公司
33.84755178Q,宁波市海太欧林家具有限公司
33.84764947A,浙江寰宇国际旅行社有限公司
33.84784673,宁波江东九树家具有限公司
33.85345682,杭州同顺实业有限公司
33.8569390XC,浙江新联工程管理咨询有限公司
33.86419909H,海宁洪胜建材科技有限公司
33.86449909H,海宁宏胜建材科技有限公司
33.8739071,浙江索思智能照明有限公司
33.87467805N,浙江新诚信工程造价咨询有限公司宁波分公司
33.87476672N,宁波园之助园艺用品有限公司
33.87477763,宁波市北仑久耀包装材料有限公司
33.87490167,宁波海曙凌利空调技术服务有限公司
33.87496550C,宁波中车新能源科技有限公司
33.87867954,瑞安市德乐五金配件有限公司
33.8800763XJ,杭州合力叉车销售有限公司宁波分公司
33.8913370XY,海盐高扬管件制造有限公司
33.90063670X,浙江中一检测研究院股份有限公司
33.90816272,袁姣君
33.9092787,杭州聚川环保科技股份有限公司
33.91001645,宁波市华测检测技术有限公司
33.91011079,王利挺
33.91201302,沈兆昌
33.91361058X,宁波庆丰建设有限公司
33.91392007,宁波拓峰自动化系统有限公司
33.9157717,宁波市江东沃岭五金工具有限公司
33.91591489E,宁波平洋机电设备有限公司
33.91594233X,浙江宇航建设有限公司
33.9190272XY,宁波高新区爱信精益生产管理咨询有限公司
33.91928656,宁波渤浪汽车部件有限公司
33.92080974,宁波市江北谷子布艺商行
33.93017207Q,余姚大器橡塑制品有限公司
33.93019915D,宁波市镇海金莉花机械厂
33.93035122Q,新日月生活服务集团股份有限公司
33.93039908K,宁波国创欣润机电技术有限公司
33.93351087H,宁波舜宇智能科技有限公司
33.93355467,宁波市海曙峰景电器有限公司
33.93358051W,宁波东方嘉迅加热设备有限公司
33.93544885X,宁波市自来水有限公司鄞州供水分公司
33.94398777F,亮兮柯电气（嘉兴）有限公司
33.94555288B,浙江久拓机电工程有限公司
33.9505934X7,宁波市鄞州恒成地毯有限公司
33.95069804M,宁波柯赛德密封科技有限公司
33.95071138B,宁波市智通人力资源服务有限公司
33.95091200Q,宁波赛茵仪器有限公司
33.95351183,宁波诺安气体有限公司
33.9537406XD,宁波新逸凡五金工具有限公司
33.95381358,宁波贝欧卡商贸有限公司
33.95382182T,宁波唯泰网络科技有限公司
33.95396905,宁波江北海通日兴机械有限公司
33.95539518K,宁波市江北洪塘鸿磊气体供应站
33.95775015,浙江台州特总电容器有限公司
33.9600265XU,浙江马良通讯科技有限公司
33.96021966,宁波市轨道交通集团有限公司
33.96047621,宁波鄞州和慈景康门诊部有限公司
33.96095250M,浙江安富新能源科技股份有限公司
33.96483860Y,稳利达电源技术有限公司
33.9665423,浙江铁铠机电科技有限公司
33.96970211H,宁波恒瑞达五金科技有限公司
33.96972188,宁波世纪国灿门业有限公司
33.97024079U,台州市轩伟塑业有限公司
33.97037478,温州天文轮胎有限公司
33.9721860XM,浙江友亿铜业有限公司
33.97586597,宁波市净美环保工程有限公司
33.97645470E,浙江旺隆轨道交通设备有限公司
33.98213728,宁波江北赛科流体设备有限公司
33.98231993X,宁波红菱加热设备有限公司
33.9823801X,宁波威讯软件有限公司
33.98243536N,宁波江北春宁电器有限公司
33.98248409B,宁波迪亚工业设备有限公司
33.98507032,乐清市矩阵商贸有限公司
33.98765916A,宁波中车现代交通投资有限公司
33.99469701,宁波宝葫芦文化传媒有限公司
33.99488718Y,宁波市国际贸易投资发展有限公司宁波泛太平洋大酒店
33.99498107,宁波彩虹大药房有限公司
33.99498334M,宁波市江东国乾消防器材有限公司
33.99546935D,宁波和丰知识产权服务有限公司
33.99643364T,宁波大学科学技术学院
33.A003P0G2M,北京宇鸿创科科技有限公司
33.A259H8Q4L,江苏千文科技有限公司
33.A27WDPX64,杭州屹伟新能源科技有限公司
33.A27WP1A8F,云上城轨（浙江）供应链有限公司
33.A27X28G4X,杭州群测电子有限公司
33.A27X4AB1P,杭州君道建筑工程有限公司
33.A27X4QK7U,传化供应链管理有限公司
33.A27YXAJ1W,杭州车盾安防科技有限公司
33.A28134G8B,宁波市新华书店有限公司
33.A2814XB4D,宁波海创建筑工程有限公司
33.A2817D640,宁波北仑心居大药房有限公司
33.A2819P662,宁波互利家政服务有限公司
33.A281ABP58,宁波防雷安全检测有限公司
33.A281CWK39,宁波中恒华运汽车科技有限公司
33.A281EUY04,浙江仁欣环科院有限责任公司
33.A281F6293,宁波市永能电力产业投资有限公司电力工程安装分公司
33.A281FKF4T,宁波协众知识产权运营有限公司
33.A281H4EXB,宁波盈信科创减震器有限公司
33.A281KCT12,宁波福顺通管道工程有限公司
33.A281R3G7E,宁波市凯捷汽车销售服务有限公司
33.A281TGX4P,宁波康存贸易有限公司
33.A281W1QX9,宁波三山文化传媒有限公司
33.A281WKLXQ,宁波嘉柏科技有限公司
33.A281XFX96,宁波海曙雷虹达电脑有限公司
33.A281YC53K,宁波市百旺信息科技有限公司
33.A2820QM4P,宁波市东晟环境设备工程有限公司
33.A28223A55,宁波市阿旭生鲜菜篮子配送有限公司
33.A2824KU29,宁波香然之合餐饮有限公司
33.A2827AM1W,宁波兴鹏汽车服务有限公司
33.A282C7J1J,浙江视联文化传播有限公司宁波分公司
33.A282C9Q1P,浙江快捷汽车股份有限公司
33.A282EDK3A,宁波市鄞州井锐物流有限公司
33.A282EYP8A,宁波老年康复医院有限公司
33.A282FC30C,宁波中忆档案服务有限公司
33.A282J0F37,奇遇激光（宁波）有限公司
33.A282JYQX8,宁波三诚电气有限公司
33.A282M0A04,贝肯霍夫(中国)有限公司
33.A282P824F,宁波路邦道路救援有限公司
33.A282PP306,宁波市和通起重吊装有限公司
33.A282QLB32,宁波涌州消防设备有限公司
33.A282RLU1K,宁波繁德奇霖橡塑有限公司
33.A282XLX2P,湖北水都消防工程有限公司宁波分公司
33.A282XW53D,浙江和美文化旅游发展有限公司
33.A282XYPXW,宁波腾煌机械制造有限公司
33.A2831EN4Y,浙江通联机电装备科技有限公司
33.A2839578K,宁波市影逸装饰工程有限公司
33.A283N4L4W,宁波市鄞州易和综合门诊部有限公司
33.A283N9983,宁波市江北杨学民供水站
33.A283W4A9D,宁波长美新能源科技有限公司
33.A283XH963,宁波宸能电力自动化工程有限公司
33.A2845BQ6D,宁波信捷检测科技有限公司
33.A284F2C11,欧菲斯办公伙伴宁波有限公司江北分公司
33.A284JNG99,宁波麦捷科智能装备有限公司
33.A284KJQ8T,宁波市海曙鄞江盛斌机械厂
33.A284MRL3G,宁波市港通装饰工程有限公司
33.A284T99XT,余姚市昌士达塑料模具厂
33.A2855287L,浙江君临电气有限公司
33.A28619B00,苍南炫林工艺品有限公司
33.A2886EY5E,浙江安环安全科技有限公司
33.A28C5QM23,湖州纽曼汽车配件有限公司
33.A28ERB165,永康市迪力斯园林工具有限公司
33.A28F8AM5L,中浙高铁轴承有限公司
33.A28KH7F0A,舟山市庆丰铁路仪表有限公司
33.A28XY908X,杭州米聊企业管理咨询有限公司
33.A28Y0DA81,宁波市鄞州五乡好友图文设计室
33.A28YFCW27,浙江缘帅实业有限公司
33.A28YT4E27,宁波市江北弘捷印章标牌社
33.A28YW49XB,宁波赛冠新材料有限公司
33.A290EL43P,宁波新广测计量检测有限公司
33.A2917NL1T,宁波博瑞润伟机电科技有限责任公司
33.A291KPJ38,宁波市北仑区新矸天山木品厂
33.A2929CK46,宁波宗顺五金有限公司
33.A292M3J4L,宁波秋澳蔬菜配送有限公司
33.A292TJA1G,宁波奴玛流体科技有限公司
33.A293D9LX7,浙江晶宏新能源科技有限公司
33.A293GN64U,宁波海晨广告标识有限公司
33.A293KBP4K,宁波东实金属制品有限公司
33.A293QUG8M,宁波市鄞州首南海鸿沙石经营部
33.A293QXKX4,宁波昊蓝智能工程有限公司
33.A29JAE41A,湖州骏才科技有限公司
33.A29PL3B1R,浙江至诚工程咨询有限责任公司义乌分公司
33.A29WKCW6W,浙江永贵博得交通设备有限公司
33.A2AE2U29G,宁波速八企业服务有限公司
33.A2AE5HD4Y,宁波欧钛电子科技有限公司
33.A2AE8H73D,宁波新材料测试评价中心有限公司
33.A2AEDMG28,宁波市海曙侃侃园艺花店
33.A2AF20L96,宁波虎视文化传媒有限公司
33.A2AFRMA71,宁波市鄞州姜山鸿升机电设备经营部
33.A2AFTAY2X,宁波市海曙古林杰创广告服务部
33.A2AFYAR9B,宁波市雍丰餐饮管理有限公司
33.A2AGY958M,浙江中创招投标有限公司
33.A2AH3KN6F,宁波市鄞州五乡社邻超市
33.A2AH9GU4U,宁波金册档案服务有限公司
33.A2AHDPT4R,宁波维衡智能科技有限公司
33.A2AJ5JLX7,宁波里聿商贸有限公司
33.A2AJ8CNXX,宁波市鄞州翌达建筑装饰工程有限公司
33.A2AJJQU65,宁波市鄞州五乡一辉汽车维修服务部
33.A2BCXQCXA,利勃海尔运输系统（中国）有限公司
33.A2BE9Y838,浙江菱电冷却设备有限公司
33.A2CD5H47L,浙江卓圣物业管理有限公司
33.A2CH9GD7D,宁波百世名门电动门有限公司
33.A2CJ4FH07,宁波市海曙合逸房产经纪有限公司
33.A2CJ8JX89,宁波海天激光科技有限公司
33.A2CJARM4U,中星时代（浙江）电气科技有限公司
33.A2CJWK26F,宁波市鄞州国鑫纸箱包装有限公司
33.A2CKU4089,盐城市防雷设施检测有限公司宁波分公司
33.A2CL0EX50,宁波盈通轨道交通科技有限公司
33.A2CMRWGXR,宁波千合广告有限公司
33.A2CXCXN2W,嘉兴博传科技有限公司
33.A2D15JK6J,华荣照明有限公司
33.A2D5JPU67,浙江华跃环境科技有限公司
33.A2DU48B8B,台州龙昌工具有限公司
33.A2EF01NXM,宁波市鄞州东吴博鑫宾馆
33.A2EFMNCXA,宁波鄞州宁东段文超蔬菜摊
33.A2EMDDK5L,宁波市江北宁发消防器材商行
33.A2EPEBY6G,余姚市星空模具手板厂
33.A2EQ6B01K,宁波市镇海区蟹浦金锋电烙铁厂
33.A2EQNL01P,宁波海曙惠利计算机经营部
33.A2EQXQ19T,宁波市海曙越创计算机销售部
33.A2GLKYT8K,杭州众略企业管理咨询有限公司
33.A2GLPU256,杭州轻胜马文化传媒有限公司
33.A2GQCDQ58,宁波卓效房地产经纪有限公司
33.A2GQFE82R,宁波厉拓焊接设备有限公司
33.A2GQT2F13,宁波江北别样时光餐饮有限公司
33.A2GTAB78K,宁波方振机电有限公司
33.A2GU16J5U,宁波驷佰贸易有限公司
33.A2GUYLJ0F,宁波隆威环保工程有限公司
33.A2GVGLX6V,宁波市周氏鹏晨环保科技有限公司
33.A2GW7C480,宁波鄞州爱康卓悦健康体检中心有限公司
33.A2GWC8X3R,宁波净美智能科技有限公司
33.A2GWMA11W,宁波市海曙立捷燃气设备厂
33.A2H136F0A,杭州明禾建设有限公司
33.A2H4C1M7Y,浙江青晟环境科技有限公司
33.A2H4J8006,宁波恒辉机电科技有限公司
33.A2H4Q7K7J,宁波青橙自动化科技有限公司
33.A2H562B2F,宁波昱晟制冷科技有限公司
33.A2H56HE2C,宁波中智数科信息技术有限公司
33.A2H5L9T55,宁波市伊隆装饰工程有限公司
33.A2H6FWB3K,宁波有好房地产经纪有限公司
33.A2H7Y5C7X,宁波圣域机械有限公司
33.A2H81DQ8K,宁波市鄞州五乡竺平副食店
33.A2H8L7CXL,宁波诺格文旅发展有限公司
33.A2H8LQX2J,宁波恒捷检测技术有限公司
33.A2H8RF09R,宁波锋泰安全技术有限公司
33.A2H8UXL3M,宁波市海曙云平房产中介服务部
33.A2H8W859U,宁波协众智库专利代理事务所（普通合伙）
33.A2H8WNU95,宁波橙意满贸易有限公司
33.A2J1XAJ8C,浙江炬和科技有限公司
33.A2J3C5RX1,宁波雄风机械有限公司
33.A2J3EPNX7,宁波得食汇餐饮服务有限公司
33.A2J3MR30T,宁波市恩泽物业服务有限公司
33.A2J436T3F,宁波北仑沃隆环境科技有限公司江北分公司
33.A2J4KE11L,宁波市语博信息技术发展有限公司
33.A2J4MMU5X,宁波萌创企业管理有限公司
33.A2J4NBH1R,浙江蓝鲲企业管理咨询有限公司
33.A2J544NXK,宁波市安宸交通装备有限公司
